02_Modelado/BASE_DIR/resultados/ejecuciones/reentrenamiento_lwu_mae_total_20261006_165727/metricas/metricas_ambitos_validation_lwu.csv

ambito,modelo,n_muestras,media_DIF,MAE,nMAE_ref_global_pct,nMAE_ambito_pct,RMSE,R2,bias,suma_error_absoluto
Global,LSTM_DIF_Elev_LWU,1464,85.23327595741702,16.840960095681076,19.75866799151275,19.75866808650521,33.42295961272124,0.9044359262911069,-0.5929982694479143,24655.165580077097
Global,NBEATS_DIF_Elev_LWU,1464,85.23327595741702,20.19536985876166,23.694231548438196,23.694231662351413,37.92985050435691,0.8769257754095239,-5.227646178205859,29566.02147322707
Operación,LSTM_DIF_Elev_LWU,884,141.7975671212168,27.395680257414227,32.142000665787876,19.320275244211214,43.00427144636458,0.8360919055587085,-0.8885164214045281,24217.781347554177
Operación,NBEATS_DIF_Elev_LWU,884,141.7975671212168,32.714724374939244,38.38257282754594,23.07142854360315,48.79200001538856,0.7890038877041095,-8.994866129133126,28919.816347446293
Completamente diurna,LSTM_DIF_Elev_LWU,765,162.72307878382065,30.761316032658996,36.09073514919024,18.904089243250944,46.13187953993422,0.7823411554402391,-1.793547262553296,23532.40676498413
Completamente diurna,NBEATS_DIF_Elev_LWU,765,162.72307878382065,36.29068794998468,42.57807454642869,22.30211486976426,52.24160593583607,0.720869650991572,-11.842248455371733,27762.37628173828
Transición,LSTM_DIF_Elev_LWU,119,7.276420718763306,5.759450273697867,6.757278986772706,79.15224388889843,7.562491199339209,-0.13765391846260178,4.929538985980408,685.3745825700462
Transición,NBEATS_DIF_Elev_LWU,119,7.276420718763306,9.726387106790012,11.411490349013976,133.66993859644637,11.837828119477262,-1.787561529503309,9.30973453954363,1157.4400657080114
Noche,LSTM_DIF_Elev_LWU,580,-0.9785057474088309,0.754110745729172,0.8847609500313474,,1.004475407190595,-9.025973557120334,-0.14258784474162706,437.3842325229198
Noche,NBEATS_DIF_Elev_LWU,580,-0.9785057474088309,1.114146768587545,1.3071734609705339,,1.7197133314783972,-28.387324887727868,0.514116643552251,646.2051257807761

02_Modelado/BASE_DIR/resultados/ejecuciones/reentrenamiento_lwu_mae_total_20261006_165727/documentacion/CONCLUSION_LWU_AMBITOS_SOLARES.md

### LSTM-LWU

- MAE global: 16.8410 W/m².
- MAE en operación: 27.3957 W/m².
- MAE nocturno: 0.7541 W/m².
- RMSE global: 33.4230 W/m².
- RMSE en operación: 43.0043 W/m².
- RMSE nocturno: 1.0045 W/m².
- La noche aporta únicamente el 1.77 % del error absoluto global.
- La operación aporta el 98.23 %.

### N-BEATS-LWU

- MAE global: 20.1954 W/m².
- MAE en operación: 32.7147 W/m².
- MAE nocturno: 1.1141 W/m².
- RMSE global: 37.9299 W/m².
- RMSE en operación: 48.7920 W/m².
- RMSE nocturno: 1.7197 W/m².
- La noche aporta únicamente el 2.19 % del error absoluto global.
- La operación aporta el 97.81 %.